VIMIAL03;Önálló laboratórium;5.0;0/0/4/f;VILLANY;MIT;BSC;OPTIONAL;6;A tantárgy keretében a hallgatók komplex mérnöki feladatot oldanak meg, amelynek eredményeként olyan műszaki alkotás jön létre, amelyben a hallgató egyéni közreműködése jól elkülöníthető. Ennek során a mérnöki munka minden lényeges fázisával megismerkednek, és az egyes részfeladatokat a lehető legnagyobb mértékben önállóan végzik el. Az Önálló laboratórium tantárgy felkészít a Szakdolgozatkészítés tantárgy elvégzésére.
GT419042;Esztétika (Építészet, vizuális kultúra, média);2.0;2/0/0/v;;;;OPTIONAL;0;A tárgy gyakorlati példák elemzésével tárgyalja az esztétika olyan alapfogalmait mint a forma, a funkció, a stílus, az ábrázolás, az ízlés és a megítélés. A fő hangsúly modern és kortárs épületek és tárgyak elemzésére és megvitatására kerül, de foglalkozunk különböző művészeti ágak alkotásaival, a magas kultúra és tömegkultúra viszonyával, a művészeti intézmények és fórumok kérdéseivel valamint a kritika jelentőségével is.
VIAUA351;Mikrokontroller laboratórium;4.0;0/0/3/f;VILLANY;AUT;;CORE;6;A tárgy célja, hogy a hallgatókat megismertesse az iparban legelterjedtebben használt mikrokontroller típusok alkalmazástechnikájával. A mérések során a hallgatók megismerkednek a beágyazott rendszerek hardver tervezési és hardverközeli programozási lépéseivel, kommunikációs és tesztelési módszereivel, a beágyazott operációs rendszerek alkalmazási problémáival. Egy kisebb (8051) és egy nagyobb (ARM) teljesítőképességű mikrokontroller fejlesztő kit és integrált fejlesztői környezet segítségével kísérik végig a beágyazott rendszerek mikrokontroller alapú fejlesztéseinek minden lépését, ezeken történik a kiadott házi feladatok megoldása is.
VIVEM819;Önálló laboratórium 1;5.0;0/0/5/f;BOTH;VET;MSC;OPTIONAL;1;A tantárgy két féléve során a hallgatók komplex mérnöki feladatot oldanak meg, amelynek eredményeként olyan műszaki alkotás jön létre, amelyben a hallgató egyéni közreműködése jól elkülöníthető. Ennek során a mérnöki munka minden lényeges fázisával megismerkednek, és az egyes részfeladatokat a lehető legnagyobb mértékben önállóan végzik el. A két féléves önálló laboratórium tantárgy felkészít a szintén két féléves Diplomatervezés tantárgy elvégzésére. Az első félév programja a téma kiválasztása, a feladat részletes specifikálása, a rendszerterv elkészítése, valamint a megoldás során időarányos előrehaladás.
VIHIM001;Innovációs és vállalkozási diplomatervezés 1;2.0;;;HIT;;OPTIONAL;0;
VIAUA000;Elektronikai rendszerek tervezése;3.0;2/1/0/f;VILLANY;AUT;BSC;SELECTABLE;0;A tárgy célja, hogy megismertesse a hallgatókat a hibrid analógdigitális elektronikai áramkörök tervezési folyamatával, módszereivel, eszközeivel, hangsúlyt fektetve a gyakorlati szempontokra. A hallgató egy komplex képet kap az áramkörök funkcionális tervezésétől a szimulációs vizsgálatokon át a nyomtatott áramkörök tervezéséig egy integrált fejlesztő környezetben. Megismerkedik a legfontosabb EDA (Electronic Design Automation) eszközökkel. A tárgy áttekinti az analóg szenzoroktól érkező jelek erősítését, szűrését, nemlineáris karakterisztikák megvalósítását végző áramköröket, a jeltovábbítás eszközeit, modulációs és demodulációs technikákat, A/D és D/A átalakítást. Kitér az analóg és a digitális szűrőtervezés módszereire.
VIHIM134;Hálózati architektúrák;4.0;2/1/0/v;BOTH;HIT;MSC;CORE;1;A tárgy célja, hogy megismertesse a hallgatókkal az újgenerációs hálózatokban alkalmazható hálózati architektúrákkal kapcsolatos (i) problémákat és (ii) megoldásokat, valamint az (iii) együttműködési vonatkozásokat (gyártmányok, technológiák, hálózatok). A tárgy további célkitűzése, hogy a hallgatóknak megismertesse az általános hálózatspecifikálási, hálózatépítő és üzemeltető alapelveket, valamint a tipikus és meghatározó NGN alkalmazások architekturális vonatkozásaival.
VIMIAA02;Digitális technika;6.0;2/1/2/v;;MIT;;OPTIONAL;0;A Digitális technika egy fontos alapozó tárgy a mérnökinformatikus szak tantervében, és legfontosabb célkitűzése a mérnöki feladat megközelítés bemutatása, az alapvető gyakorlati ismeretek, önálló probléma megoldási készségek kialakítása. A tárgy bemutatja a számítástechnikai rendszerek alapelemeinek működését, a digitális absztrakció tulajdonságait, az egyszerűbb feladatok közvetlen hardveres, ill. alacsonyszintű szoftveres megoldását. A bináris aritmetika, a műveletvégzők, funkcionális egységek, vezérlők tervezésének bemutatásán keresztül jut el az általános célú mikrovezérlő architektúra ismertetéséig, az elemi CPU használat, periféria illesztés alkalmazásáig. A tárgyhoz kapcsolódó gyakorlatok és laboratóriumi foglalkozások során a hangsúly a korszerű számítógépes tervezői módszerek elsajátításán és a közvetlen, alapfokú tervezési/fejlesztési tapasztalatszerzésen van.A Digitális technika egy fontos alapozó tárgy a mérnökinformatikus szak tantervében, és legfontosabb célkitűzése a mérnöki feladat megközelítés bemutatása, az alapvető gyakorlati ismeretek, önálló probléma megoldási készségek kialakítása. A tárgy bemutatja a számítástechnikai rendszerek alapelemeinek működését, a digitális absztrakció tulajdonságait, az egyszerűbb feladatok közvetlen hardveres, ill. alacsonyszintű szoftveres megoldását. A bináris aritmetika, a műveletvégzők, funkcionális egységek, vezérlők tervezésének bemutatásán keresztül jut el az általános célú mikrovezérlő architektúra ismertetéséig, az elemi CPU használat, periféria illesztés alkalmazásáig. A tárgyhoz kapcsolódó gyakorlatok és laboratóriumi foglalkozások során a hangsúly a korszerű számítógépes tervezői módszerek elsajátításán és a közvetlen, alapfokú tervezési/fejlesztési tapasztalatszerzésen van.
VITMM325;Infokommunikációs rendszerek teljesítményelemzése;4.0;2/1/0/v;BOTH;TMIT;MSC;SELECTABLE;2;A tantárgy célja, hogy a hallgatók megismerjék azokat a modern elemzési technikákat a szükséges elméleti háttérrel együtt, melyekkel a modern infokommunikációs hálózatok analízise és tervezése végrehajtható. Az elméleti tárgyalás mellett nagy hangsúlyt kap a módszerek gyakorlati alkalmazhatósága is. A tantárgy célkitűzése, hogy erős alapozást adjon az adott területen tovább tanulni és kutatni kívánó hallgatók majdani doktoranduszi kutatási tevékenységéhez, így a példákat és esettanulmányokat a legújabb és legizgalmasabb nemzetközi kutatási témák közül válogatjuk.
VIAUA048;Internet laboratórium;3.0;0/0/2/f;;AUT;BSC;CORE;0;A tantárgy célja, hogy a hallgatók átfogó ismereteket szerezzenek a modern szoftvertechnológiák ill. azok alkalmazásának elméletéről és gyakorlatáról. Elsődleges célképet adnia korszerű szoftver alapú rendszerekről, az ezeket felépítő komponensekről és az ipari automatizálási alkalmazásokról. Szintén lényeges a félév során elvégzett projekt feladat révén gyakorlathoz juttatni a hallgatókat. Olyan tudással felruházni őket, mely későbbiekben lehetővé teszi a kérdéses területen való elmélyedést, irányt mutatni az ismeretek bővítésére és hatékony alkalmazására.
VITMM323;Nagysebességű mobil távközlés;4.0;2/1/0/v;INFO;TMIT;MSC;SELECTABLE;3;A tárgy célja a hallgatók megismertetése a korszerű nagysebességű mozgótávközlési hálózatok architektúrájával, működésének alapjaival, protokolljaival, és szolgáltatásaival, különös tekintettel a harmadik generációs (3G) mozgó távközlési rendszerekre (a tárgynak nem célja a rádiós interfész fizikai rétegének (WCDMA) részletes ismertetése). A tárgy külön foglalkozik a 3G rendszerek fejldődési irányaival.
VIMIAV16;Mérési adatok vizuális elemzése;2.0;2/0/0/f;BOTH;MIT;;OPTIONAL;0;A műszaki gyakorlatban kulcsfontosságú a tapasztalati adatok gyűjtése és elemzése mind a rendszerek méretezésénél, mind teljesítmény és időviszonyaik helyességének ellenőrzésénél. Ennek legegyszerűbb, de hatékony és a műszaki szemlélethez közel álló megközelítése a vizuális adatelemzés. Ennek tipikus alkalmazási területei: HW/SW teljesítményvizsgálat, web és felhő alapú rendszerek méretezése, komponensek közti kommunikáció vizsgálata, szűk keresztmetszetek keresése. A tantárgy alapvető célkitűzése megismertetni a hallgatókat a vizuális adatelemzés alkalmazási lehetőségeivel, elsődlegesen műszaki alkalmazásokban, informatikai rendszerek tervezésében és kiértékelésében. A tárgy statisztikai/elméleti alapozás után gyakorlati példákon keresztül mutatja be az elemzési folyamat főbb feladatait (adatgyűjtés és tisztítás, modellalkotás, feltáró és megerősítő elemzés, stb.). A tantárgy elvégzése után a hallgatók képesek lesznek méréseket tervezni, benchmarkokból és rendszermonitorozásból/logokból származó adatokat kiértékelni, a rendszer működéséből adódó sajátosságokat (pl. elemek közti függőségek, kapcsolatok) az elemzés során módszeresen felhasználni, ill. a rendszerről alkotott feltételezéseket elemzésekkel kiértékelni és alátámasztani. Az elemzési eredmények hatékonyan fejleszthető, intuitív felületeken keresztül különböző részletességgel és fókusszal tudják megjeleníteni mind informatikusok/rendszermérnökök, mind a rendszerek felhasználói ill. megrendelői számára. A tárgy oktatása során elsősorban a vizuális megjelenítésre helyezzük a hangsúlyt, korszerű vizuális elemzési technológiákon keresztül ismertetve az alapvető módszereket, emellett kitekintünk a széles körben használt R nyelv interaktív vizualizációs lehetőségeire.
VITMA003;Távközlő hálózatok és szolgáltatások;3.0;2/1/0/v;;TMIT;;CORE;0;A tantárgy célkitűzése elméletileg is megalapozott gyakorlati ismeretek nyújtása a távközlő hálózatok témaköréből. Ide tartozik a hálózatok által nyújtott szolgáltatásoknak a megismertetése, az egyes alkalmazások hálózat felé támasztott követelményeinek áttekintése a rendszertechnikai elemek kiválasztásához, alkalmazásához, az üzemeltetéshez, és a különböző szolgáltatók hálózatainak együttműködéséhez szükséges legfontosabb alapismeretek elsajátíttatása, különös tekintettel a vezetékes hozzáférésre.
VIVEBV16;Excel és Matlab alkalmazások mérnököknek;3.0;2/0/0/f;;VET;;OPTIONAL;0;Tapasztalat szerint sok hallgatót elriasztanak az olyan szakmai feladatok, amelyek többkevesebb számítógép programozást igényelnek  legyen szó akár önálló laboratórium, akár TDK munka, akár szakdolgozat ill. diplomaterv készítés során felmerülő feladatokról  mert ezek egy része az alapképzésben megismert programnyelvek segítségével csak nagy (és felesleges) idő és munkaráfordítással oldható meg. Többnyire mindenkinek rendelkezésére állnak azonban olyan szoftverek (egyszerűbb feladatokra Excel / VBA, összetettebb vagy szakmaspecifikus feladatokra Matlab és környezete) amelyekkel ezek a feladatok egyszerűen és  némi ismerkedés után  gyorsan megoldhatók. A tárgy célja, hogy  legyőzze a hallgatókban a programozzással járó feladatokkal szemben esetleg jelen lévő távolságtartást  olyan újrahasznosítható készségeket fejlesszen ki a hallgatókban, amelyek segítségével az Excel / VBA ill. a Matlab programcsomag adta lehetőségeket képesek lesznek kihasználni  akár későbbi szakmai életük során is  eközben néhány, a mérnöki gyakorlatban felmerülő komplex probléma konkrét megoldási lépéseit bemutassa (egészen a szoftver rutinok kódolásának szintjéig), ezzel segítse a hallgatót a mérnöki problémák megoldási technikáinak rutinszerű elsajátításában.
GT201503;Számvitel mérnököknek;2.0;2/0/0/v;VILLANY;;;OPTIONAL;0;A tantárgy célja, hogy megismertesse a hallgatókat a vállalkozások számviteli rendszerével, elsajátítják a számvitel szemléletmódját, jártassá válnak a gazdaság e fontos információs folyamatában. A tantárgy a mérnök hallgatók számára készült, így nyelvezete, stílusa, felépítése az mérnök hallgatók szemléletmódját tükrözi. Részletesen foglalkozik a számvitellel mint információs rendszerrel, mely szerves részét képezi egy gazdasági szervezet informatikai rendszerének.
TE125135;Elektron- és ionoptikák;2.0;2/0/0/v;VILLANY;;;OPTIONAL;79;A címben nevezett téma elméleti és gyakorlati megismertetése.
VIHID014;Tömegkiszolgáló rendszerek numerikus analízise;5.0;4/0/0/v;;HIT;;OPTIONAL;0;Napjaink tömegkiszolgáláselméleti kutatásai sok ponton megelőzték a modellezési módszerekhez kapcsolódó numerikus eljárások fejlesztését, a módszerek gyakorlati alkalmazhatóságának elemzését. A tárgy célja, hogy bemutassa a tömegkiszolgáláselmélet korszerű modellezési módszereihez kapcsolódó numerikus eljárásokat, azok implementációs és számítási bonyolultságát, számíthatóságának korlátait. A tantárgy ezzel elő kívánja segíteni, hogy a hallgatók képessé váljanak a részben más tárgyak keretében ismertetett módszerek alkalmazására valós rendszerek elemzése során.
VIMIAL02;Témalaboratórium;3.0;0/0/2/f;VILLANY;MIT;BSC;OPTIONAL;5;
VIHIM353;Távközlési rendszerek fejlesztése;4.0;2/1/0/v;VILLANY;HIT;MSC;CORE;3;A tárgy keretében a hallgatók megismerkednek (i) a távközlési berendezések és szoftverek tervezésének és fejlesztésének problémáival, módszereivel és eszközeivel, továbbá. (ii) a nagy megbízhatóságú távközlési berendezések és szoftverek tervezésének és megvalósításának gyakorlati kérdéseivel és általánosan alkalmazható módszereivel.
VIAUA001;Mobil eszközök villamosenergia ellátása;3.0;2/0/1/f;;AUT;BSC;SELECTABLE;0;A tárgy bővíti az elektronikai és a teljesítményelektronikai ismereteket. Áttekinti a mobil eszközök villamos energia előállításának, tárolásának, elosztásának, külső töltési megoldásainak szokásos és jövőbeni megoldásait. Kiemelten kezeli a konverterek alkalmazását.
VIHIM002;Innovációs és vállalkozási diplomatervezés 2;4.0;;;HIT;;OPTIONAL;0;
GT468934;Banki információs rendszerek működtetése;3.0;2/0/0/v;VILLANY;;;OPTIONAL;9;A bankinformatikai / pénzinformatikai képzés tárgyainak együttes célkitűzése alkalmazott orientációjú pénzintézeti és pénzügyi informatikai tudás biztosítása. E tárgy ebből különösen a technológiai és rendszertechnikai ismeretekre koncentrál.
GT61A051;Műszaki nyelv - német - B2;2.0;;;;;OPTIONAL;0;
VIHIM220;Hírközlő rendszerek biztonsága laboratórium I;4.0;0/0/3/f;INFO;HIT;MSC;CORE;2;A laborgyakorlatok célja, hogy a hallgatók kézzelfogható gyakorlati tapasztalatokat szerezzenek a kommunikációs hálózatok tervezése és analízise, valamint az informatikai biztonság területén, s ezzel elmélyítsék az előadásokon elhangzott anyag megértését.
VITMM324;Navigációs szolgáltatások és alkalmazások;4.0;2/1/0/v;INFO;TMIT;MSC;SELECTABLE;3;Átfogó mérnöki ismeretek nyújtása az igen gyorsan terjedő navigációs és helymeghatározó szolgáltatások elmélete és gyakorlata terén. A helymeghatározó és navigációs rendszerek alapszolgáltatása a felhasználó/objektum pozíciójának meghatározása. A pozícióhoz kapcsolódóan a különböző rendszerek más és más további szolgáltatásokat nyújtanak, pl.: navigáció, mobil eszközök erőforráshasználata, lokalizáción alapuló szolgáltatások, biztonsági és vészhelyzeti szolgáltatások. A tantárgy betekintést nyújt a helymeghatározó és navigációs rendszerek elméletébe, tárgyalja a kültéri és a beltéri helymeghatározási technológiákat és módszereket majd alkalmazásokon és esettanulmányokon keresztül bemutatja ezek lehetséges felhasználását. A tananyag elsajátítása rendszerszemléletű és alkalmazásorientált tudást biztosít a témakörben.
VISZA208;Valószínűségszámítás;4.0;3/1/0/v;INFO;SZIT;BSC;OPTIONAL;3;A sztochasztikus modellalkotás alapjainak elsajátítása
VITMA002;Adatbázisok;3.0;2/1/0/v;;TMIT;;CORE;2;
KOKA8554;Vasúti járművek és kitérők kapcsolata;2.0;;;;;OPTIONAL;0;
VIMIAV15;AUTOSAR alapú autóipari szoftverrendszerek;4.0;2/0/2/v;BOTH;MIT;;OPTIONAL;0;A tárgy hallgatói megismerkednek az AUTOSAR alapú szoftverrendszerekkel, az aktuális szoftver és biztonsági szabványokkal. A laborgyakorlatok során AUTOSAR fejlesztőeszközök segítségével elosztott beágyazott szoftvereket készítenek, megismerve az autóipari szoftverfejlesztés minden lépését. A tantárgyhoz kapcsolódóan a hallgatók látogatást tehetnek a ThyssenKrupp Presta Hungary Kft. tesztlaborjában is, ahol első kézből kapnak információt a különböző szintű tesztelés tipikus eljárásairól és eszközeiről is.
VIHVMA01;Szélessávú vezeték nélküli hírközlő és műsorszóró rendszerek;4.0;2/1/0/v;VILLANY;SZHVT;MSC;OPTIONAL;1;A Hírközléselmélet tantárgyban előadott elméleti alapokra építve a szélessávú vezeték nélküli hírközlő és műsorszóró rendszerek alapvető eljárásainak ismertetése az alábbi témakörök szerint.  Az első a digitális hírközlés néhány speciális kérdésével foglalkozik, így a spektrumhatékony kódolási eljárásokkal (nagy állapotszámú digitális modulációk  MQAM, folytonos fázisú modulációk  CPM, többvivős modulációs eljárások  OFDM, FBMC) kódolt modulációs rendszerekkel, kiterjesztett spektrumú rendszerekkel (konstans és változó sebességű szolgáltatások esetére is), a többszörös hozzáférésű rendszerekkel (CDMA, FDMA, TDMA, SDMA), többfelhasználós vételi eljárásokkal.  A második rész az átviteli közegek tulajdonságait ismerteti, áttekintve a földi és műholdas mikrohullámú közeg, a mobil valamint a fix telepítésű és műsorszóró (földfelszíni és műholdas) rádiócsatorna tulajdonságait (pl. WSSUS), kitérve a pontpont, ponttöbbpont (pl.: MIMO) csatornákra is.  A harmadik rész speciális rendszereket, berendezéseket ismertet, így földi és műholdas műsorszóró és kommunikációs rendszereket, beleértve a DAB, DVB és DRM rendszereket, a szélessávú, fix telepítésű, vezetéknélküli hozzáférési (BFWA) hálózatokat a mobil és műsorszóró hálózatok konvergenciájának elemeivel együtt (SDR, LTE, 5G, DVB IP, DVB RCT/S/C).  A negyedik rész mélyrehatóan ismerteti a korszerű digitális műsorszóró és kommunikációs rendszerek méréstechnikáját, részletezve az idő és frekvenciatartománybeli jellemzőket, modulációanalízist és bithiba, illetve csomaghibaarány vizsgálatokat. Ugyancsak szemléltetjük ezen rendszerek alapsávi rendszerábrázolását, modellezési és szimulációs eljárásait, adott sztochasztikus jellemzőkkel rendelkező valós és komplex jelek előállítását, a rendszerjellemzők szimulációs becslését.  A félév végére a hallgatók birtokába jutnak azon ismereteknek, melyekkel képesek lesznek a jövő szélessávú fix és mobil kommunikációs, továbbá műsorszóró rendszereinek alapvető  fizikai rétegbeli  tulajdonságainak tervezésére, modellezésére és vizsgálatára.
GT209429;Tárgyalástechnika a mérnöki menedzsmentben A2;2.0;2/0/0/v;VILLANY;;;OPTIONAL;0;A piacorientált üzleti világban való biztonságos mozgáshoz új gondolkodási és cselekvési módra van szükség. A sokrétű együttműködéshez nélkülözhetetlen: a széles látókör, a humán háttérműveltség, a hatékony és vonzó kapcsolatteremtés, a tárgyalási készség és képesség magabiztos tudása és kezelése. Különösen fontos azonban a menedzseri eszköztár mesterfogásainak ismerete (így: a kapcsolat és légkörteremtés, a tárgyalási stratégiák és taktikák, stb.) és gyakorlata. A tantárgy mindezek tudatosítását, érvényesülését és érvényesítését segíti. Segíti továbbá a hallgatókat hivatásuk és szakmájuk gyakorlásában, így a résztvevők saját valós, vélt és/vagy akart menedzserei, vezetői képességeiket kontrollálhatják, szembesíthetik és fejleszthetik.
VIHIA077;Pénzügyi információs rendszerek;5.0;2/2/0/v;;HIT;;OPTIONAL;0;
VIIIAV18;Smart megoldások az internet világában;2.0;2/0/0/f;BOTH;IIT;;OPTIONAL;0;
VIHVML00;Önálló laboratórium 1;5.0;0/0/3/f;INFO;SZHVT;MSC;OPTIONAL;1;A tantárgy keretében a hallgatók komplex mérnöki feladatot oldanak meg, amelynek eredményeként olyan műszaki alkotás jön létre, amelyben a hallgató egyéni közreműködése jól elkülöníthető. Ennek során a mérnöki munka minden lényeges fázisával megismerkednek, és az egyes részfeladatokat a lehető legnagyobb mértékben önállóan végzik el. A két féléves önálló laboratórium tantárgy felkészít a szintén két féléves Diplomatervezés tantárgy elvégzésére.  Az első félév programja a téma kiválasztása, a feladat részletes specifikálása, a rendszerterv elkészítése, valamint a megoldás során időarányos előrehaladás.
GT61G0K1;Német középfokú gazdasági szaknyelv 2. rész;0.0;;;;;OPTIONAL;0;
EOAF-L52;Nagyméretarányú digitális térképezés;2.0;;;;;OPTIONAL;0;
GEGT2089;Gépipari technológia;3.0;;;;;OPTIONAL;0;
TE135504;Alapozó fizika;2.0;;;;;OPTIONAL;0;
VIHIM003;Diplomatervezés 1;4.0;;;HIT;;OPTIONAL;0;
GEATKM05;Mérnöki alapok III.;-1.0;;;null;;OPTIONAL;0;
VIMIAA00;Rendszermodellezés;4.0;2/1/0/f;INFO;MIT;BSC;OPTIONAL;2;A tantárgy tematikusan az informatikai rendszerek tervezési folyamatának modell alapú megközelítését tárgyalja. Célkitűzése a későbbi tantárgyak által megtanítandó specializált modellezési paradigmák előkészítése, az alapvető modellezési feladatok és eszközök bemutatásával. Egyúttal bemutat néhány olyan fogalmilag tiszta és egyszerűen kezelhető eszközt is, amelyek segítségével a tervezés alapvető aspektusait a hallgatók készség szinten elsajátíthatják és egyszerű, működő alkalmazásokat is tudnak tervezni. A hallgatók megismerik a magas szintű, grafikus eszközökre épülő, folyamat alapú rendszermodellezés, a helyességbizonyítás, teljesítményanalízis és szolgáltatásbiztonság alapfogalmait és megjelenésüket a modellezésben. A korábbi automataelméleti és rendszertechnikai ismereteikre építve megismerik a szabatos rendszertervezés alapjait. A hallgatók a modellezés munkafolyamatain keresztül elsajátítják az informatikai rendszerek implementációjának egyes munkafogásait. Jártasságot szereznek a szimulációs rendszervizsgálatokban és a mérési adatok vizuális elemzésében. A tárgy kiemelt didaktikai célja a hallgatók absztrakciós készségének fejlesztése és a későbbi szakmai tárgyak fogalmi és motivációs előkészítése. A tantárgy követelményeit eredményesen teljesítő hallgatók:
VIMIAL01;Önálló laboratórium;5.0;0/0/4/f;INFO;MIT;BSC;OPTIONAL;6;A tantárgy keretében a hallgatók komplex mérnöki feladatot oldanak meg, amelynek eredményeként olyan műszaki alkotás jön létre, amelyben a hallgató egyéni közreműködése jól elkülöníthető. Ennek során a mérnöki munka minden lényeges fázisával megismerkednek, és az egyes részfeladatokat a lehető legnagyobb mértékben önállóan végzik el. Az Önálló laboratórium tantárgy felkészít a Szakdolgozatkészítés tantárgy elvégzésére.
VIAUA002;BIT II. Programozás;5.0;2/0/3/v;;AUT;;CORE;0;A számítógépes problémamegoldás megközelítési módjainak és általános módszereinek megismerése, a tipikus adatszerkezetek kezelésének és az alapvető algoritmusok megvalósításának elsajátítása, alapfokú jártasság megszerzése egy egyszerű, de korszerű, platformfüggetlen programozási nyelv használatában (Python) az imperatív programozás szemléletének és az objektumorientált programozás alapjainak megértése.
GT468935;Bankbiztonság és adatvédelem;3.0;2/0/0/v;VILLANY;;;OPTIONAL;910;A bankinformatikai képzés tárgyainak együttes célkitűzése alkalmazott orientációjú bankinformatikai tudás biztosítása
GT468937;Tőkekihelyezés, finanszírozás, projektkövetés informatikája;3.0;2/0/0/v;VILLANY;;;OPTIONAL;8;A bankinformatikai képzés tárgyainak együttes célkitűzése alkalmazott orientációjú bankinformatikai tudás biztosítása.
KOKA8553;Vasúti biztosítóberendezések III.;2.0;;;;;OPTIONAL;0;
VITMA001;Az Infokommunikáció alapjai;6.0;3/2/0/v;;TMIT;;OPTIONAL;6;Az Infokommunikáció tárgy alapvető célja, hogy megismertesse a távközlésre és számítógép hálózatokra is kiterjedő infokommunikáció sajátos kérdésfelvetéseit, valamint e kérdések megválaszolásának legfontosabb módszereit és eljárásait. Az előadások, a gyakorlatok és a számonkérés módszere együttesen arra törekszik, hogy a hallgatók a megismert elemeket, módszereket és eljárásokat egyrészt műszaki szakoktatói módon tudják alkalmazni, másrészt elegendően sok fix pontot kapjanak ahhoz, hogy a számukra újdonságnak tűnő vagy ténylegesen új infokommunikációs rendszereket és szolgáltatásokat kevés utánjárással megértsék.
GT301192;Mikroökonómia II. KG;5.0;;;;;OPTIONAL;0;
